[
  {"id":"direct_answer_first","text":{"ru":"Начни с прямого ответа, затем добавь только необходимое пояснение.","en":"Start with the direct answer, then add only the necessary explanation."},"intents":["simple_question","explanation","problem_solving"],"forbiddenIntents":[],"activateWhenAny":[],"deactivateWhenAny":[],"weight":8,"lengthCost":1,"conflicts":[],"dependsOn":[],"dedupeKey":"answer_order"},
  {"id":"concise_simple","text":{"ru":"Не раздувай ответ, если вопрос допускает короткий однозначный результат.","en":"Keep the answer compact when the question has a short unambiguous result."},"intents":["simple_question","definition"],"forbiddenIntents":[],"activateWhenAny":[],"deactivateWhenAny":[],"weight":9,"lengthCost":1,"conflicts":["response_format"],"dependsOn":[],"dedupeKey":"concise"},
  {"id":"explain_plain","text":{"ru":"Объясни терминологию понятным языком, не теряя технической точности.","en":"Explain the terminology in plain language without losing technical accuracy."},"intents":["explanation","learning"],"forbiddenIntents":[],"activateWhenAny":[],"deactivateWhenAny":[],"weight":8,"lengthCost":2,"conflicts":[],"dependsOn":[],"dedupeKey":"plain_explanation"},
  {"id":"define_then_example","text":{"ru":"Дай краткое определение и один уместный пример.","en":"Give a concise definition and one relevant example."},"intents":["definition","explanation"],"forbiddenIntents":[],"activateWhenAny":[],"deactivateWhenAny":[],"weight":8,"lengthCost":2,"conflicts":[],"dependsOn":[],"dedupeKey":"definition_example"},
  {"id":"compare_practical","text":{"ru":"Сравни практические различия по критериям, влияющим на использование.","en":"Compare practical differences using criteria that affect real use."},"intents":["comparison","purchase_research","decision_support"],"forbiddenIntents":[],"activateWhenAny":[],"deactivateWhenAny":[],"weight":9,"lengthCost":3,"conflicts":[],"dependsOn":[],"dedupeKey":"practical_comparison"},
  {"id":"compare_table","text":{"ru":"Сведи сопоставимые характеристики в компактную таблицу.","en":"Put directly comparable characteristics in a compact table."},"intents":["comparison","purchase_research"],"forbiddenIntents":[],"activateWhenAny":[],"deactivateWhenAny":["без таблицы","no table"],"weight":7,"lengthCost":3,"conflicts":[],"dependsOn":[],"dedupeKey":"comparison_format"},
  {"id":"compare_tradeoffs","text":{"ru":"Покажи преимущества, недостатки и существенные компромиссы каждого варианта.","en":"Show the advantages, disadvantages, and material trade-offs of each option."},"intents":["comparison","decision_support"],"forbiddenIntents":[],"activateWhenAny":[],"deactivateWhenAny":[],"weight":8,"lengthCost":3,"conflicts":[],"dependsOn":[],"dedupeKey":"tradeoffs"},
  {"id":"recommendation_by_scenario","text":{"ru":"Заверши рекомендацией по сценариям, не придумывая отсутствующие предпочтения.","en":"End with a recommendation by scenario without inventing missing preferences."},"intents":["comparison","recommendation","purchase_research","decision_support"],"forbiddenIntents":[],"activateWhenAny":[],"deactivateWhenAny":["без рекомендации","no recommendation"],"weight":8,"lengthCost":2,"conflicts":[],"dependsOn":[],"dedupeKey":"recommendation"},
  {"id":"verify_revisions","text":{"ru":"Проверь, не относятся ли различия к разным версиям или ревизиям.","en":"Check whether the differences come from distinct versions or revisions."},"intents":["comparison","purchase_research"],"forbiddenIntents":[],"activateWhenAny":[],"deactivateWhenAny":[],"weight":5,"lengthCost":2,"conflicts":[],"dependsOn":[],"dedupeKey":"revision_check"},
  {"id":"separate_marketing","text":{"ru":"Отдели подтверждаемые характеристики от маркетинговых заявлений.","en":"Separate verifiable specifications from marketing claims."},"intents":["comparison","purchase_research","research"],"forbiddenIntents":[],"activateWhenAny":[],"deactivateWhenAny":[],"weight":6,"lengthCost":2,"conflicts":[],"dependsOn":[],"dedupeKey":"marketing_vs_fact"},
  {"id":"purchase_criteria","text":{"ru":"Используй измеримые критерии выбора и явно свяжи их с задачей пользователя.","en":"Use measurable selection criteria and tie them explicitly to the user's task."},"intents":["purchase_research","recommendation"],"forbiddenIntents":[],"activateWhenAny":[],"deactivateWhenAny":[],"weight":9,"lengthCost":3,"conflicts":[],"dependsOn":[],"dedupeKey":"purchase_criteria"},
  {"id":"price_availability_current","text":{"ru":"Для цены и доступности проверяй актуальность и указывай дату сведений.","en":"For price and availability, verify freshness and state the information date."},"intents":["purchase_research","current_information"],"forbiddenIntents":[],"activateWhenAny":[],"deactivateWhenAny":[],"weight":7,"lengthCost":2,"conflicts":[],"dependsOn":[],"dedupeKey":"price_freshness"},
  {"id":"disclose_assumptions","text":{"ru":"Отделяй известные факты от предположений и явно помечай неопределённость.","en":"Separate known facts from assumptions and label uncertainty explicitly."},"intents":["recommendation","decision_support","research","planning"],"forbiddenIntents":[],"activateWhenAny":[],"deactivateWhenAny":[],"weight":8,"lengthCost":2,"conflicts":[],"dependsOn":[],"dedupeKey":"assumptions"},
  {"id":"rank_options","text":{"ru":"Ранжируй варианты по указанным критериям и объясни основание порядка.","en":"Rank the options by the stated criteria and explain the ordering."},"intents":["recommendation","decision_support","brainstorming"],"forbiddenIntents":[],"activateWhenAny":[],"deactivateWhenAny":["не ранжируй","do not rank"],"weight":7,"lengthCost":3,"conflicts":[],"dependsOn":[],"dedupeKey":"ranking"},
  {"id":"decision_matrix","text":{"ru":"Сопоставь варианты и критерии в прозрачной матрице решения без выдуманных весов.","en":"Map options to criteria in a transparent decision matrix without invented weights."},"intents":["decision_support"],"forbiddenIntents":[],"activateWhenAny":[],"deactivateWhenAny":[],"weight":8,"lengthCost":4,"conflicts":[],"dependsOn":[],"dedupeKey":"decision_matrix"},
  {"id":"compare_total_cost","text":{"ru":"Учитывай совокупную стоимость владения только по доступным данным.","en":"Consider total cost of ownership using only available data."},"intents":["purchase_research","decision_support"],"forbiddenIntents":[],"activateWhenAny":[],"deactivateWhenAny":[],"weight":5,"lengthCost":2,"conflicts":[],"dependsOn":[],"dedupeKey":"total_cost"},
  {"id":"diagnose_causes","text":{"ru":"Сначала выдели возможные причины, не выдавая гипотезы за установленный факт.","en":"Identify possible causes first without presenting hypotheses as established facts."},"intents":["troubleshooting","technical_diagnosis"],"forbiddenIntents":[],"activateWhenAny":[],"deactivateWhenAny":[],"weight":9,"lengthCost":3,"conflicts":[],"dependsOn":[],"dedupeKey":"diagnose_causes"},
  {"id":"rank_causes","text":{"ru":"Ранжируй причины по вероятности и соответствию наблюдаемым симптомам.","en":"Rank causes by likelihood and fit with the observed symptoms."},"intents":["troubleshooting","technical_diagnosis","debugging"],"forbiddenIntents":[],"activateWhenAny":[],"deactivateWhenAny":[],"weight":10,"lengthCost":3,"conflicts":[],"dependsOn":["diagnose_causes"],"dedupeKey":"cause_ranking"},
  {"id":"safe_checks","text":{"ru":"Предлагай безопасные проверки от простых и обратимых к более сложным.","en":"Suggest safe checks from simple and reversible to more involved."},"intents":["troubleshooting","technical_diagnosis","how_to","medical_information"],"forbiddenIntents":[],"activateWhenAny":[],"deactivateWhenAny":[],"weight":10,"lengthCost":3,"conflicts":[],"dependsOn":[],"dedupeKey":"safe_checks"},
  {"id":"expected_vs_actual","text":{"ru":"Раздели ожидаемое и фактическое поведение.","en":"Separate expected behavior from actual behavior."},"intents":["technical_diagnosis","debugging"],"forbiddenIntents":[],"activateWhenAny":[],"deactivateWhenAny":[],"weight":7,"lengthCost":2,"conflicts":[],"dependsOn":[],"dedupeKey":"expected_actual"},
  {"id":"reproduction_steps","text":{"ru":"Укажи минимальные шаги воспроизведения и условия появления ошибки.","en":"State minimal reproduction steps and the conditions that trigger the error."},"intents":["debugging","code_review"],"forbiddenIntents":[],"activateWhenAny":[],"deactivateWhenAny":[],"weight":8,"lengthCost":3,"conflicts":[],"dependsOn":[],"dedupeKey":"reproduction"},
  {"id":"minimal_fix","text":{"ru":"Предложи минимальную обоснованную правку до более широких изменений.","en":"Propose the smallest justified fix before broader changes."},"intents":["debugging","troubleshooting"],"forbiddenIntents":[],"activateWhenAny":[],"deactivateWhenAny":[],"weight":8,"lengthCost":2,"conflicts":[],"dependsOn":[],"dedupeKey":"minimal_fix"},
  {"id":"verify_fix","text":{"ru":"Объясни, как проверить результат и исключить регрессию.","en":"Explain how to verify the result and rule out a regression."},"intents":["debugging","troubleshooting","technical_diagnosis","configuration","how_to","problem_solving"],"forbiddenIntents":[],"activateWhenAny":[],"deactivateWhenAny":[],"weight":8,"lengthCost":2,"conflicts":[],"dependsOn":[],"dedupeKey":"verify_result"},
  {"id":"diagnose_symptoms","text":{"ru":"Сохрани все наблюдаемые симптомы и связывай проверки с каждым из них.","en":"Preserve every observed symptom and tie checks to each one."},"intents":["troubleshooting","technical_diagnosis"],"forbiddenIntents":[],"activateWhenAny":[],"deactivateWhenAny":[],"weight":9,"lengthCost":2,"conflicts":[],"dependsOn":[],"dedupeKey":"symptom_preservation"},